{
  "schema_version": 1,
  "id": "paris-en-escargot",
  "language": "fr",
  "genre": "fiction",
  "visibility": "public",
  "status": "draft",
  "title": "Paris en escargot",
  "topic": {
    "type": "theme",
    "name": "Paris, arrondissement par arrondissement: a year-long walk across the city in the order the arrondissements really spiral, clockwise from the centre. Exactly 21 chapters: chapter 1 is an introduction (why Paris is divided into twenty arrondissements, the snail-shaped numbering from the Louvre, and the narrator setting off); chapters 2 to 21 are the 1er to the 20e, one chapter per arrondissement, in numerical order. One invented narrator walks the whole way (a person with a clear reason for the walk, and one or two recurring companions). Each arrondissement chapter happens in the season when that district is at its best, and says so, with real seasonal details of that district; for example the harvest festival (Fete des Vendanges de Montmartre, in October) belongs to the 18th, not the 19th. The 19th is a summer evening at the Canal de l'Ourcq, La Villette or the Buttes-Chaumont. Spread the seasons so the walk covers a full year. Only state real, verifiable facts about each arrondissement (landmarks, streets, markets, food, customs); no invented claims about the real city."
  },
  "summary": "Après la mort de sa grand-mère, Camille Lefebvre décide de parcourir Paris arrondissement par arrondissement, dans l'ordre de la spirale, pour accomplir un dernier vœu. De la cour du Louvre aux allées du Père-Lachaise, elle découvre vingt visages de la capitale et le secret d'une vieille boîte en fer.",
  "levels": [
    "A1",
    "A2",
    "B1",
    "B2",
    "C1"
  ],
  "characters": [
    {
      "name": "Camille Lefebvre",
      "description": "Narrator, 34, a bookbinder from Lille who has just inherited her grandmother's flat in Paris. Stubborn, observant, a little shy; she wants to fulfil her grandmother's last wish by walking through all twenty arrondissements."
    },
    {
      "name": "Odette Lefebvre",
      "description": "Camille's grandmother, 91 at her death, a former Parisian schoolteacher. Appears only through her letters and a tin box of twenty postcards, one for each arrondissement."
    },
    {
      "name": "Monsieur Armand Bensaïd",
      "description": "72, retired bus driver of the RATP, Odette's old neighbour. Knows every street by heart, loves to talk, walks with a cane and joins Camille on many stages."
    },
    {
      "name": "Inès Moreau",
      "description": "27, a photographer and Camille's new friend, born in the 20th arrondissement. Funny, energetic, she photographs each stage of the walk for an exhibition."
    }
  ],
  "chapters": [
    {
      "number": 1,
      "title": "La spirale",
      "period": "Late September, Paris (Île de la Cité and the Louvre courtyard)",
      "summary": "Camille arrives in Paris to empty her grandmother Odette's flat and finds a tin box with twenty postcards and a letter asking her to walk through all the arrondissements in order. Monsieur Bensaïd explains the snail shape, and Camille sets off from the Louvre. The hook: the first postcard is blank except for a Tuileries ticket stub.",
      "key_facts": [
        {
          "claim": "Paris is divided into twenty arrondissements, each with its own mairie and mayor, a system that dates in its present form from 1860, when Paris annexed surrounding communes."
        },
        {
          "claim": "The numbering starts at the 1er arrondissement, in the centre around the Louvre, and spirals clockwise outward like a snail shell, which is why Parisians call it 'l'escargot'."
        },
        {
          "claim": "The 1er and the 20e are far apart on the map but the spiral ends on the north-east side, at the 20e, after the 19e."
        },
        {
          "claim": "The Seine divides Paris into the Rive droite (north) and the Rive gauche (south); the arrondissements 5, 6, 7, 13, 14 and 15 are on the Rive gauche."
        },
        {
          "claim": "Before 1860 Paris had twelve arrondissements; the 1860 reform created twenty by annexing communes such as Montmartre, Belleville and Passy."
        },
        {
          "claim": "Paris intra-muros covers about 105 square kilometres, small enough to cross on foot in a few hours."
        }
      ]
    },
    {
      "number": 2,
      "title": "Le jardin et le palais",
      "period": "Early October, 1er arrondissement (Tuileries, Palais-Royal)",
      "summary": "In the golden light of early autumn, Camille and Monsieur Bensaïd cross the Jardin des Tuileries and the Palais-Royal gardens, where a clue sends them to a bookseller in the Galerie de Montpensier. The turn: the bookseller knew Odette and gives Camille a second letter.",
      "key_facts": [
        {
          "claim": "The Jardin des Tuileries was laid out in the 17th century by André Le Nôtre and runs between the Louvre and the place de la Concorde."
        },
        {
          "claim": "The Palais-Royal gardens are surrounded by arcades housing small shops, and the Colonnes de Buren in the main courtyard were installed in 1986."
        },
        {
          "claim": "The glass Pyramide du Louvre, designed by I. M. Pei, was inaugurated in 1989."
        },
        {
          "claim": "Green metal chairs in the Tuileries are free for anyone to move and sit on."
        },
        {
          "claim": "The Palais-Royal gardens have long been known for antique and old-book dealers and small galleries under the galleries."
        },
        {
          "claim": "The Louvre was a royal palace before becoming a museum open to the public in 1793."
        }
      ]
    },
    {
      "number": 3,
      "title": "Sous la verrière",
      "period": "November, 2e arrondissement (Galerie Vivienne, rue Montorgueil)",
      "summary": "On a rainy November day Camille shelters in the covered passages of the 2e, then follows the second postcard to rue Montorgueil. She tastes pastries at a historic pâtisserie and learns Odette once worked as a teacher nearby. The turn: Inès appears, photographing the same passage.",
      "key_facts": [
        {
          "claim": "The 2e is the smallest arrondissement in Paris by area and is known for its covered passages from the early 19th century, such as Galerie Vivienne and Passage des Panoramas."
        },
        {
          "claim": "Galerie Vivienne has a mosaic floor and a glass roof, and houses a wine shop and a bookshop."
        },
        {
          "claim": "The Passage des Panoramas, opened in 1800, is considered one of the oldest covered passages in Paris."
        },
        {
          "claim": "The rue Montorgueil is a partly pedestrian market street with cheesemongers, fishmongers and bakeries."
        },
        {
          "claim": "The Stohrer pâtisserie on rue Montorgueil, founded in 1730, is said to be one of the oldest in Paris and is known for the baba au rhum and puits d'amour."
        },
        {
          "claim": "The Palais Brongniart, the former Bourse, is in the 2e arrondissement."
        }
      ]
    },
    {
      "number": 4,
      "title": "Les Enfants-Rouges",
      "period": "Early December, 3e arrondissement (Marais nord)",
      "summary": "Camille, Inès and Monsieur Bensaïd walk the northern Marais in pre-Christmas cold, stopping at the Marché des Enfants Rouges. A stallholder recognises Odette's handwriting on the postcard. The turn: a name on the card, 'Jeanne', sends them toward the next stage.",
      "key_facts": [
        {
          "claim": "The Marché des Enfants Rouges is the oldest covered food market in Paris still operating, dating from 1628."
        },
        {
          "claim": "The market has stalls offering Moroccan, Japanese, Lebanese and Italian dishes alongside fresh produce."
        },
        {
          "claim": "The Musée Picasso is housed in the Hôtel Salé on the rue de Thorigny in the 3e."
        },
        {
          "claim": "The Carreau du Temple, a former covered market, is now a cultural and sports centre."
        },
        {
          "claim": "The Musée Carnavalet, devoted to the history of Paris, is on rue de Sévigné in the Marais, and reopened in 2021 after renovation."
        },
        {
          "claim": "Rue des Archives and rue de Bretagne mark the 3e arrondissement's streets and the Marais district straddles the 3e and 4e."
        }
      ]
    },
    {
      "number": 5,
      "title": "Au pied de la cathédrale",
      "period": "January, 4e arrondissement (Île Saint-Louis, Notre-Dame, Hôtel de Ville)",
      "summary": "On a clear cold January morning they cross the Île Saint-Louis, eating ice cream from a famous glacier, and see the rebuilt Notre-Dame. Camille meets Jeanne, an old friend of Odette. The turn: Jeanne reveals Odette once planned the same walk and never finished.",
      "key_facts": [
        {
          "claim": "Notre-Dame de Paris stands on the Île de la Cité; a fire in April 2019 destroyed its roof and spire, and the cathedral reopened to the public in December 2024."
        },
        {
          "claim": "The Île Saint-Louis is a residential island next to the Île de la Cité, and the Berthillon ice cream shop is on rue Saint-Louis-en-l'Île."
        },
        {
          "claim": "The place des Vosges, the oldest planned square in Paris, completed in 1612, lies on the border of the 3e and 4e arrondissements."
        },
        {
          "claim": "The Hôtel de Ville, Paris's city hall, has a skating rink in front of it in winter."
        },
        {
          "claim": "The Centre Pompidou, opened in 1977, sits partly in the 4e arrondissement at Beaubourg and is closed for renovation from 2025."
        },
        {
          "claim": "The Marché aux Fleurs on the Île de la Cité is on place Louis-Lépine, in the 4e."
        }
      ]
    },
    {
      "number": 6,
      "title": "La galette du Quartier latin",